{
  "$schema": "https://json-schema.org/draft/2020-12/schema",
  "$id": "hyf_ops_v2/farm_update_interpret.response.schema.json",
  "title": "hyf_ops_v2 farm_update.interpret strict response (ADR-0025 D45 CB01-CB04, ADR-0026 D46 CR01-CR02)",
  "$comment": "Exact pre-activation wire algebra: ok:true requires output and forbids error; ok:false requires error and forbids output and meta. Proposals only, never inventory mutation. quantity uses the D23 reported decimal-string projection. Envelope version stays 1. output.versions echoes the requested seven axes; execution.model is the actual model use.",
  "type": "object",
  "properties": {
    "version": {
      "type": "integer",
      "const": 1
    },
    "request_id": {
      "type": "string"
    },
    "trace_id": {
      "type": "string",
      "minLength": 1
    },
    "ok": {
      "type": "boolean"
    },
    "output": {
      "$ref": "#/$defs/farm_output"
    },
    "error": {
      "$ref": "#/$defs/wire_error"
    },
    "meta": {
      "type": "object",
      "additionalProperties": true
    }
  },
  "required": ["version", "request_id", "ok"],
  "additionalProperties": false,
  "allOf": [
    {
      "if": {
        "properties": {"ok": {"const": true}},
        "required": ["ok"]
      },
      "then": {
        "required": ["output"],
        "properties": {"request_id": {"type": "string", "minLength": 1}},
        "not": {"required": ["error"]}
      }
    },
    {
      "if": {
        "properties": {"ok": {"const": false}},
        "required": ["ok"]
      },
      "then": {
        "required": ["error"],
        "not": {"anyOf": [{"required": ["output"]}, {"required": ["meta"]}]}
      }
    }
  ],
  "$defs": {
    "wire_error": {
      "type": "object",
      "properties": {
        "code": {
          "type": "string",
          "enum": [
            "invalid_request",
            "unsupported_capability",
            "capability_disabled",
            "capability_unavailable",
            "internal_error"
          ]
        },
        "message": {"type": "string"}
      },
      "required": ["code", "message"],
      "additionalProperties": false
    },
    "output_versions": {
      "type": "object",
      "properties": {
        "schema": {"type": "string", "const": "hyf_ops_v2"},
        "taxonomy": {"type": "string", "minLength": 1},
        "normalization": {"type": "string", "minLength": 1},
        "review_policy": {"type": "string", "minLength": 1},
        "ranking_policy": {"type": "string", "minLength": 1},
        "question_bundle": {"type": "string", "minLength": 1},
        "model": {"type": "string", "minLength": 1}
      },
      "required": [
        "schema",
        "taxonomy",
        "normalization",
        "review_policy",
        "ranking_policy",
        "question_bundle",
        "model"
      ],
      "additionalProperties": false
    },
    "evidence_span": {
      "type": "object",
      "properties": {
        "kind": {"type": "string", "const": "span"},
        "source_id": {"type": "string", "minLength": 1},
        "revision": {"type": "string", "minLength": 1},
        "start": {"type": "integer", "minimum": 0},
        "end": {"type": "integer", "minimum": 0},
        "method": {"type": "string", "minLength": 1}
      },
      "required": ["kind", "source_id", "revision", "start", "end", "method"],
      "additionalProperties": false
    },
    "record_field_evidence": {
      "type": "object",
      "properties": {
        "kind": {"type": "string", "const": "record_field"},
        "source_id": {"type": "string", "minLength": 1},
        "revision": {"type": "string", "minLength": 1},
        "record_id": {"type": "string", "minLength": 1},
        "field": {"type": "string", "minLength": 1},
        "method": {"type": "string", "const": "trusted_record"}
      },
      "required": [
        "kind",
        "source_id",
        "revision",
        "record_id",
        "field",
        "method"
      ],
      "additionalProperties": false
    },
    "evidence_ref": {
      "oneOf": [
        {"$ref": "#/$defs/evidence_span"},
        {"$ref": "#/$defs/record_field_evidence"}
      ]
    },
    "reported_quantity": {
      "type": "object",
      "properties": {
        "state": {"type": "string", "enum": ["known", "unknown"]},
        "value": {
          "type": ["string", "null"],
          "pattern": "^-?(0|[1-9][0-9]*)(\\.[0-9]{1,9})?$"
        },
        "unit": {"type": ["string", "null"], "minLength": 1},
        "qualifier": {"type": "string", "enum": ["exact", "approximate"]}
      },
      "required": ["state", "qualifier"],
      "additionalProperties": false,
      "allOf": [
        {
          "if": {
            "properties": {"state": {"const": "unknown"}},
            "required": ["state"]
          },
          "then": {
            "properties": {"value": {"type": "null"}, "unit": {"type": "null"}}
          }
        },
        {
          "if": {
            "properties": {"state": {"const": "known"}},
            "required": ["state"]
          },
          "then": {
            "properties": {
              "value": {
                "type": "string",
                "pattern": "^-?(0|[1-9][0-9]*)(\\.[0-9]{1,9})?$"
              },
              "unit": {"type": "string", "minLength": 1}
            },
            "required": ["value", "unit"]
          }
        }
      ]
    },
    "product_ref": {
      "type": "object",
      "properties": {
        "phrase": {"type": "string", "minLength": 1},
        "catalogue_id": {"type": ["string", "null"], "minLength": 1},
        "resolution": {"type": "string", "enum": ["resolved", "unresolved"]}
      },
      "required": ["phrase", "catalogue_id", "resolution"],
      "additionalProperties": false
    },
    "claim": {
      "type": "object",
      "properties": {
        "claim_id": {"type": "string", "minLength": 1},
        "product": {"$ref": "#/$defs/product_ref"},
        "status": {
          "type": "string",
          "enum": ["offered", "forecast", "unavailable", "correction", "unclear"]
        },
        "quantity": {"$ref": "#/$defs/reported_quantity"},
        "evidence": {
          "type": "array",
          "items": {"$ref": "#/$defs/evidence_ref"}
        },
        "review_required": {"type": "boolean"}
      },
      "required": ["claim_id", "product", "status", "evidence", "review_required"],
      "additionalProperties": false
    },
    "proposed_change": {
      "type": "object",
      "properties": {
        "target": {
          "type": "object",
          "properties": {
            "kind": {"type": "string", "enum": ["listing", "product", "farm"]},
            "id": {"type": ["string", "null"], "minLength": 1}
          },
          "required": ["kind", "id"],
          "additionalProperties": false
        },
        "operation": {
          "type": "string",
          "enum": [
            "addition",
            "remaining",
            "replacement",
            "withdrawal",
            "correction",
            "unresolved"
          ]
        },
        "expected_revision": {"type": ["string", "null"], "minLength": 1},
        "evidence": {
          "type": "array",
          "items": {"$ref": "#/$defs/evidence_ref"}
        }
      },
      "required": ["target", "operation", "evidence"],
      "additionalProperties": false,
      "allOf": [
        {
          "if": {
            "properties": {
              "target": {
                "properties": {"id": {"type": "string", "minLength": 1}},
                "required": ["id"]
              }
            },
            "required": ["target"]
          },
          "then": {
            "required": ["expected_revision"],
            "properties": {
              "expected_revision": {"type": "string", "minLength": 1}
            }
          }
        },
        {
          "if": {
            "properties": {
              "target": {
                "properties": {"id": {"type": "null"}},
                "required": ["id"]
              }
            },
            "required": ["target"]
          },
          "then": {
            "properties": {"expected_revision": {"type": "null"}}
          }
        }
      ]
    },
    "review": {
      "type": "object",
      "properties": {
        "required": {"type": "boolean"},
        "clarifications": {
          "type": "array",
          "items": {
            "type": "object",
            "properties": {
              "field": {"type": "string", "minLength": 1},
              "reason": {"type": "string", "minLength": 1}
            },
            "required": ["field", "reason"],
            "additionalProperties": false
          }
        }
      },
      "required": ["required", "clarifications"],
      "additionalProperties": false
    },
    "execution": {
      "type": "object",
      "properties": {
        "status": {"type": "string", "enum": ["complete", "degraded", "failed"]},
        "provider_calls": {"type": "integer", "minimum": 0},
        "model": {"type": ["string", "null"]},
        "question_bundle": {"type": ["string", "null"]},
        "degraded_reason": {"type": ["string", "null"], "minLength": 1}
      },
      "required": [
        "status",
        "provider_calls",
        "model",
        "question_bundle",
        "degraded_reason"
      ],
      "additionalProperties": false,
      "allOf": [
        {
          "if": {
            "properties": {"status": {"const": "degraded"}},
            "required": ["status"]
          },
          "then": {
            "required": ["degraded_reason"],
            "properties": {"degraded_reason": {"type": "string", "minLength": 1}}
          }
        },
        {
          "if": {
            "properties": {"status": {"enum": ["complete", "failed"]}},
            "required": ["status"]
          },
          "then": {"properties": {"degraded_reason": {"type": "null"}}}
        },
        {
          "if": {
            "properties": {"provider_calls": {"const": 0}},
            "required": ["provider_calls"]
          },
          "then": {"properties": {"model": {"type": "null"}}}
        }
      ]
    },
    "provenance_identity": {
      "type": "object",
      "properties": {
        "source_id": {"type": "string", "minLength": 1},
        "revision": {"type": "string", "minLength": 1}
      },
      "required": ["source_id", "revision"],
      "additionalProperties": false
    },
    "clarification_identity": {
      "type": "object",
      "properties": {
        "source_id": {"type": "string", "minLength": 1},
        "revision": {"type": "string", "minLength": 1}
      },
      "required": ["source_id", "revision"],
      "additionalProperties": false
    },
    "prior_record_identity": {
      "type": "object",
      "properties": {
        "record_id": {"type": "string", "minLength": 1},
        "revision": {"type": "string", "minLength": 1}
      },
      "required": ["record_id", "revision"],
      "additionalProperties": false
    },
    "farm_output_provenance": {
      "type": "object",
      "$comment": "ADR-0027 D47 BP01: immutable identities actually used for every successful farm interpretation, independently of optional detailed evidence and context.return_provenance. source equals the interpreted input.source revision; clarification is non-null only when that supplied clarification was used; prior_records lists only supplied records actually consulted. Repeated identical identity/revision pairs and identity/coverage disagreement are semantic obligations owned by C023/C030.",
      "properties": {
        "source": {"$ref": "#/$defs/provenance_identity"},
        "clarification": {
          "oneOf": [
            {"type": "null"},
            {"$ref": "#/$defs/clarification_identity"}
          ]
        },
        "prior_records": {
          "type": "array",
          "items": {"$ref": "#/$defs/prior_record_identity"}
        }
      },
      "required": ["source", "clarification", "prior_records"],
      "additionalProperties": false
    },
    "farm_output": {
      "type": "object",
      "properties": {
        "versions": {"$ref": "#/$defs/output_versions"},
        "provenance": {"$ref": "#/$defs/farm_output_provenance"},
        "claims": {
          "type": "array",
          "items": {"$ref": "#/$defs/claim"}
        },
        "proposed_changes": {
          "type": "array",
          "items": {"$ref": "#/$defs/proposed_change"}
        },
        "review": {"$ref": "#/$defs/review"},
        "execution": {"$ref": "#/$defs/execution"}
      },
      "required": [
        "versions",
        "provenance",
        "claims",
        "proposed_changes",
        "review",
        "execution"
      ],
      "additionalProperties": false
    }
  }
}
