{
  "version": 1,
  "request_id": "farm-interpret-req-1",
  "trace_id": "farm-interpret-trace-1",
  "ok": true,
  "output": {
    "versions": {
      "schema": "hyf_ops_v2",
      "taxonomy": "hyf_ops_v2.taxonomy.v1",
      "normalization": "hyf_ops_v2.normalization.v1",
      "review_policy": "hyf_ops_v2.review_policy.v1",
      "ranking_policy": "hyf_ops_v2.ranking_policy.v1",
      "question_bundle": "hyf_ops_v2.question_bundle.v1",
      "model": "jev-1.13.0"
    },
    "provenance": {
      "source": {"source_id": "src-farm-1", "revision": "rev-7"},
      "clarification": {"source_id": "src-clar-1", "revision": "rev-1"},
      "prior_records": [{"record_id": "record-100", "revision": "rev-2"}]
    },
    "claims": [
      {
        "claim_id": "claim-1",
        "product": {"phrase": "Roma tomatoes", "catalogue_id": "tomato.roma", "resolution": "resolved"},
        "status": "offered",
        "quantity": {"state": "known", "value": "80.00", "unit": "lb", "qualifier": "approximate"},
        "evidence": [
          {"kind": "span", "source_id": "src-farm-1", "revision": "rev-7", "start": 11, "end": 21, "method": "span"}
        ],
        "review_required": true
      }
    ],
    "proposed_changes": [
      {
        "target": {"kind": "listing", "id": "record-100"},
        "operation": "remaining",
        "expected_revision": "rev-2",
        "evidence": [
          {"kind": "span", "source_id": "src-farm-1", "revision": "rev-7", "start": 11, "end": 21, "method": "span"}
        ]
      }
    ],
    "review": {
      "required": true,
      "clarifications": [{"field": "quantity", "reason": "approximation_requested"}]
    },
    "execution": {
      "status": "complete",
      "provider_calls": 0,
      "model": null,
      "question_bundle": null,
      "degraded_reason": null
    }
  }
}
